{
  "messageId": "eeeeeeee-eeee-4eee-8eee-eeeeeeeeeeee",
  "messageType": "processing.artifact.created",
  "schemaVersion": 1,
  "occurredAt": "2026-08-01T12:04:00Z",
  "traceId": "trace-01J4EXAMPLE",
  "correlationId": "job-01J4EXAMPLE",
  "causationId": "worker-01J4EXAMPLE",
  "payload": {
    "jobId": "22222222-2222-4222-8222-222222222222",
    "attemptId": "66666666-6666-4666-8666-666666666666",
    "leaseId": "77777777-7777-4777-8777-777777777777",
    "artifactId": "ffffffff-ffff-4fff-8fff-ffffffffffff",
    "kind": "profile",
    "objectKey": "reports/22222222-2222-4222-8222-222222222222/attempt-1/profile.json",
    "sizeBytes": 2048,
    "contentType": "application/json",
    "checksumSha256": "0123456789abcdef0123456789abcdef0123456789abcdef0123456789abcdef"
  }
}
