{
  "messageId": "44444444-4444-4444-8444-444444444444",
  "messageType": "processing.job.cancel-requested",
  "schemaVersion": 1,
  "occurredAt": "2026-08-01T12:00:00Z",
  "traceId": "trace-01J4EXAMPLE",
  "correlationId": "job-01J4EXAMPLE",
  "causationId": "api-request-01J4EXAMPLE",
  "payload": {
    "jobId": "22222222-2222-4222-8222-222222222222",
    "attemptId": null,
    "leaseId": null,
    "reason": "requested by dataset owner"
  }
}
