{
  "messageId": "cccccccc-cccc-4ccc-8ccc-cccccccccccc",
  "messageType": "processing.worker.heartbeat",
  "schemaVersion": 1,
  "occurredAt": "2026-08-01T12:03:00Z",
  "traceId": "trace-worker-01J4EXAMPLE",
  "correlationId": "worker-01J4EXAMPLE",
  "causationId": "worker-01J4EXAMPLE",
  "payload": {
    "workerId": "88888888-8888-4888-8888-888888888888",
    "instanceId": "worker-instance-1",
    "hostname": "pipeforge-worker-1",
    "supportedOperations": ["PROFILE_DATASET", "CHECK_MISSING_VALUES"],
    "softwareVersion": "0.1.0",
    "status": "BUSY",
    "currentConcurrency": 1,
    "maxConcurrency": 2,
    "currentJobIds": ["22222222-2222-4222-8222-222222222222"],
    "observedAt": "2026-08-01T12:03:00Z"
  }
}
