{
  "messageId": "11111111-1111-4111-8111-111111111111",
  "messageType": "processing.job.requested",
  "schemaVersion": 1,
  "occurredAt": "2026-08-01T12:00:00Z",
  "traceId": "trace-01J4EXAMPLE",
  "correlationId": "job-01J4EXAMPLE",
  "causationId": "api-request-01J4EXAMPLE",
  "payload": {
    "jobId": "22222222-2222-4222-8222-222222222222",
    "datasetVersionId": "33333333-3333-4333-8333-333333333333",
    "operations": [
      { "type": "PROFILE_DATASET", "config": {} },
      { "type": "CHECK_MISSING_VALUES", "config": { "columns": ["email"] } }
    ]
  }
}
