{
  "messageId": "11111111-1111-4111-8111-111111111111",
  "messageType": "processing.job.queued",
  "schemaVersion": 1,
  "occurredAt": "2026-08-03T12:00:00Z",
  "traceId": "trace-01J4EXAMPLE",
  "correlationId": "job-01J4EXAMPLE",
  "causationId": "api-request-01J4EXAMPLE",
  "payload": {
    "jobId": "22222222-2222-4222-8222-222222222222"
  }
}
