{
  "messageId": "aaaaaaaa-aaaa-4aaa-8aaa-aaaaaaaaaaaa",
  "messageType": "processing.job.succeeded",
  "schemaVersion": 1,
  "occurredAt": "2026-08-01T12:05:00Z",
  "traceId": "trace-01J4EXAMPLE",
  "correlationId": "job-01J4EXAMPLE",
  "causationId": "worker-01J4EXAMPLE",
  "payload": {
    "jobId": "22222222-2222-4222-8222-222222222222",
    "attemptId": "66666666-6666-4666-8666-666666666666",
    "leaseId": "77777777-7777-4777-8777-777777777777",
    "workerId": "88888888-8888-4888-8888-888888888888",
    "artifacts": ["reports/22222222-2222-4222-8222-222222222222/attempt-1/profile.json"]
  }
}
