{
  "messageId": "dddddddd-dddd-4ddd-8ddd-dddddddddddd",
  "messageType": "processing.worker.registered",
  "schemaVersion": 1,
  "occurredAt": "2026-08-01T11:59:00Z",
  "traceId": "trace-worker-01J4EXAMPLE",
  "correlationId": "worker-01J4EXAMPLE",
  "causationId": "worker-01J4EXAMPLE",
  "payload": {
    "workerId": "88888888-8888-4888-8888-888888888888",
    "instanceId": "worker-instance-1",
    "hostname": "pipeforge-worker-1",
    "supportedOperations": ["PROFILE_DATASET", "CHECK_MISSING_VALUES"],
    "softwareVersion": "0.1.0",
    "maxConcurrency": 2,
    "startedAt": "2026-08-01T11:58:00Z"
  }
}
